{
  "$schema": "https://json-schema.org/draft/2020-12/schema",
  "$id": "beatfall/contracts/analysis.schema.json",
  "title": "AnalysisDoc",
  "type": "object",
  "required": ["songId", "analysisVersion", "title", "duration", "bpm", "beatGrid", "roster", "events", "energyCurves"],
  "properties": {
    "songId": { "type": "string", "pattern": "^yt:[A-Za-z0-9_-]{11}$" },
    "analysisVersion": { "type": "integer", "minimum": 1 },
    "title": { "type": "string" },
    "channel": { "type": "string" },
    "duration": { "type": "number", "exclusiveMinimum": 0 },
    "thumbnail": { "type": "string" },
    "bpm": { "type": "number", "exclusiveMinimum": 0 },
    "beatGrid": { "type": "array", "items": { "type": "number", "minimum": 0 } },
    "roster": {
      "type": "array",
      "items": { "enum": ["drummer", "bassist", "singer", "guitarist"] },
      "uniqueItems": true
    },
    "events": { "type": "array", "items": { "$ref": "#/$defs/event" } },
    "energyCurves": {
      "type": "object",
      "required": ["sampleRateHz", "stems"],
      "properties": {
        "sampleRateHz": { "type": "number", "exclusiveMinimum": 0 },
        "stems": {
          "type": "object",
          "additionalProperties": { "type": "array", "items": { "type": "number", "minimum": 0, "maximum": 1 } }
        }
      }
    }
  },
  "$defs": {
    "event": {
      "type": "object",
      "required": ["t", "stem", "kind", "strength"],
      "properties": {
        "t": { "type": "number", "minimum": 0 },
        "stem": { "enum": ["drums", "bass", "vocals", "other"] },
        "kind": { "enum": ["onset", "sustain"] },
        "strength": { "type": "number", "minimum": 0, "maximum": 1 },
        "dur": { "type": "number", "exclusiveMinimum": 0 },
        "pitch": { "type": "number", "description": "MIDI note number, optional, only when confidently detected" },
        "pitchConf": { "type": "number", "minimum": 0, "maximum": 1 },
        "drum": { "enum": ["kick", "snare", "hat"], "description": "optional percussion class for drum onsets" }
      }
    }
  }
}
